,,State,Statute,Category / Model,Requirement (summary),Provision (summary),Text Excerpt,,,,,,,,
,1,Alabama,No school-specific statute identified in current review,,,,,,,,,,,,
,2,Alaska,No school-specific statute identified in current review,,,,,,,,,,,,
,3,Arizona,No school-specific statute identified in current review,,,,,,,,,,,,
,4,Arkansas,No school-specific statute identified in current review,,,,,,,,,,,,
1,5,California,Cal. Elec. Code §2146(a) & (b),Secretary of State responsibility to distribute VR forms to schools,"Form Distribution:
High schools are required to designate a person responsible for distributing voter registration forms, and the Secretary of State is required to distribute forms to high schools. ",Requirement for Secretary of State to provide high schools with voter registration forms.,"Cal Elec Code 2146 (a) The Secretary of State shall annually provide every high school, community college, and California State University and University of California campus with voter registration forms. The Secretary of State shall provide additional forms to a school, free of charge, if so requested by a school. 
(b) The Secretary of State shall provide a written notice with each registration form describing eligibility requirements and informing each student that he or she may return the completed form in person or by mail to the elections official of the county in which the student resides or to the Secretary of State.",,,,,,,,
1,5,California,Cal. Elec. Code §2146(e),Statement of legislative intent,permissive; don't include,Intent of legislature for high schools to encourage voter registration,"Cal Elec Code 2146 (e) ""It is the intent of the Legislature that every eligible high school and college student receive a meaningful opportunity to apply to register to vote. It is also the intent of the Legislature that every school do all in its power to ensure that students are provided the opportunity and means to apply to register to vote. This may include providing voter registration forms at the start of the school year, including voter registration forms with orientation materials; placing voter registration forms at central locations, including voter registration forms with graduation materials; or providing hyperlinks to, and the Internet Web site address of, the Secretary of State's electronic voter registration system in notices sent by electronic mail to students and placed on the Internet Web site of the high school, college, or university.""",,,,,,,,
1,5,California,Cal. Elec. Code §2148,Designation of person responsible to distribute forms in high schools,included in form distribution in row 6.,Requirement for high schools to designate person responsible for distributing voter registration forms,"(a) Every high school, community college, and California State University campus shall designate a contact person and provide his or her address, telephone number, and e-mail address, when possible, to the Secretary of State for the Secretary of State to contact in order to facilitate the distribution of voter registration cards, as provided under this article.",,,,,,,,
1,5,California,Cal. Educ. Code § 49040,Civic registration weeks,"Special Days:
The last two full weeks in April and September are designated as High School Voter Education Weeks, during which during time persons authorized by the county elections official shall be allowed to register students and school personnel on any high school campus.",Establishes statewide High School Voter Education Weeks allowing on-campus registration activities.,"49040. (a) The last two full weeks in April and the last two full weeks in September shall be known as ""high school voter education weeks,"" during which time persons authorized by the county elections official shall be allowed to register students and school personnel on any high school campus.
(b) This section does not preclude a person from registering to vote students and school personnel on a high school campus as is otherwise permitted by the Elections Codes",,,,,California,Educ. Code §§ 49040–49041,Civic registration weeks,Establishes High School Voter Education Weeks and allows student voter-outreach coordinators.
1,5,California,Cal. Educ. Code § 49041,Student outreach coordinators,permissive; don't include,Schools may appoint student voter outreach coordinators to organize registration and civic participation.,"(a) The administrator of a high school, or his or her designee, may appoint one or more pupils who are enrolled at that high school to be voter outreach coordinators.
(b) A voter outreach coordinator may coordinate voter registration activities on his or her high school campus that encourage persons who are eligible to register to vote pursuant to Section 2101 of the Elections Code, or other persons who may submit an affidavit of registration pursuant to Section 2102 of the Elections Code, to apply to register to vote by submitting an affidavit of registration on paper or electronically on the Internet Web site of the Secretary of State.
(c) A voter outreach coordinator may, with the approval of the administrator of the high school, or his or her designee, coordinate election-related activities on his or her high school campus, including voter registration drives, mock elections, debates, and other election-related pupil outreach activities.",,,,,,,,
2,6,Colorado,Colo. Rev. Stat. § 1-2-401,Statement of legislative intent,permissive; don't include,Intent to make VR more convenient,"It is the intent of the general assembly that, in order to promote and encourage voter registration of all eligible electors in the state, registration should be made as convenient as possible. It is determined by the general assembly that if voter registration is convenient, the number of registered voters will increase. It is further determined by the general assembly that support and cooperation of school officials and interested citizens will make high school registration successful. It is therefore the purpose of this part 4 to encourage voter registration by providing convenient registration procedures for qualified high school students, employees, and other persons by using high school deputy registrars.",,,,,,,,
2,6,Colorado,Colo. Rev. Stat. § 1-2-402,School registrar,permissive; don't include,High school principals or designees may serve as deputy registrars.,"(1) Each principal of a public high school, or the principal's designee who is a registered voter in the county, may serve as a deputy registrar. The principal of each high school shall notify the county clerk and recorder of the county in which the high school is located of the name of the school's deputy registrar, and the county clerk and recorder shall maintain a list of the names of all of the high school deputy registrars in that county in a public file.
(2) The high school deputy registrar may register or preregister any student, employee of the school, other person who attends school functions, or any other person who is eligible to register or preregister to vote. Voter registration may be made available only when the school is open for classes or any other school or community function. The high school deputy registrar shall take registrations or preregistrations only on school district premises.
(3) A high school deputy registrar may have available an official application form for voter registration for each student who is eighteen years of age or who will be eighteen years of age at the time of the next election. A high school deputy registrar may have available an official application form for preregistration for each student who is fifteen years of age.",,,,,Colorado,"CRS §§ 1-2-402, 1-2-403",School registrar,High school principals or designees may serve as deputy registrars; county clerks train them.
2,6,Colorado,Colo. Rev. Stat. § 1-2-403(1) & (2),Implementation / training,"Training:
The county clerk and recorder shall train and supervise the high school deputy registrars.

Form Distribution:
The county clerk and recorder shall issue sufficient materials to each high school deputy registrar for the registration or preregistration of all eligible students, employees, and other persons at the high school which the high school deputy registrar serves.",County clerks must train high school deputy registrars and provide registration materials.,"(1) The county clerk and recorder shall train and supervise the high school deputy registrars, and, after training is completed, shall administer the oath of office to the high school deputy registrars.
(2) The county clerk and recorder shall issue sufficient materials to each high school deputy registrar for the registration or preregistration of all eligible students, employees, and other persons at the high school which the high school deputy registrar serves. The high school deputy registrar shall give a receipt to the county clerk and recorder for all materials issued.",,,,,,,,
3,7,Connecticut,Conn. Gen. Stat. § 9-17(c),Registration sessions,"Form distribution and registration sessions:
Registrars of voters must hold registration sessions in public high schools annually in the winter or spring and must distribute voter registration information in high schools in September each year
",Election registrars must hold registration sessions in public high schools annually and must distribute voter registration information in high schools,"the registrars of voters in each town shall: (1) Hold one session each year, between the first of January and the last day of the school year, at each public high school in such town, for the admission of persons who are eligible for admission under subsection (a) or (b) of section 9-12, provided, in the case of a public high school in a regional school district, such session shall be held on a rotating basis by the registrars of voters for each town which is a member of the regional school district. The registrars of voters need not give notice of this session by publication in a newspaper; and
(2) Distribute each year, on the fourth Tuesday of September, at each public high school in such town, information regarding eligibility for admission under subsection (a) or (b) of section 9-12 and procedures for applying for such admission. The registrars of voters and the principal of any such public high school shall determine the best means of distributing such information at such public high school.",,,,,Connecticut,CGS § 9-17,Registration sessions,Registrars must hold a voter-registration session annually in each public high school.
,8,Delaware,15 Del. C. § 2050A,Registration opportunity in schools,,Department of Elections coordinates registration opportunities in high schools.,“The Department shall establish procedures to provide voter registration opportunities in each public high school in the State.”,,,,,Delaware,15 Del. C. § 2050A,School registration opportunity,Department of Elections must provide voter-registration opportunities in public high schools.
4,9,Florida,Fla. Admin. Code Ann. R. 1S-2.033,HSVR program requirement,"Education and Training:
County supervisor must conduct high school voter registration / education program in each high school",County supervisor must conduct high school voter registration / education program in each high school,"(3) Voter Registration/Education and Training Programs. 
A county supervisor of elections shall:
(a) Conduct at least once a year a high school voter registration/education program in each public high school in the county. The program must be developed in cooperation with the local school board and be designed for maximum effectiveness in reaching and educating high school students who are eligible to pre-register or register.",,,,,,,,
5,10,Georgia,O.C.G.A. § 20-2-310(b),Civic information requirement,"Education: 
Each public school student shall be apprised of his or her right to register as an elector and to vote in elections 

Special Days:
Each eligible student shall be given an opportunity, arranged by the school administration, to register to vote at his or her school during the month of April of each year. ",Schools provide students information on civic responsibilities including voter registration.,"(b) Each eligible student in the public schools of this state shall be apprised of his or her right to register as an elector and to vote in elections and of any obligation to register with the Selective Service System. Each eligible student shall be given an opportunity, arranged by the school administration, to register to vote at his or her school during the month of April of each year. The State Board of Education shall promulgate rules and regulations to carry out this Code section. An excused absence of a student to register or vote, at the discretion of the local unit of administration, shall not exceed one school day.",,,,,Georgia,O.C.G.A. § 20-2-310,Civic information / forms,Schools provide students information about voter registration and civic responsibilities.
,11,Hawaii,No school-specific statute identified in current review,,,,,,,,,,,,
,12,Idaho,No school-specific statute identified in current review,,,,,,,,,,,,
6,13,Illinois,10 ILCS 5/1A-60,"Distribution of materials
Access for drives","Form Distribution:
Schools must distribute voter registration materials to high schools",Schools must distribute voter registration materials to high schools and may not prohibit nonpartisan voter-registration activity on campus.,"(a) The State Board of Elections shall prepare a one page document explaining the process to register to vote to be disseminated to high school age students. Every high school must provide students with that document, which may be disseminated electronically.
(b) No high school may prohibit nonpartisan voter registration activities on its premises. A high school may adopt reasonable regulations restricting nonpartisan voter registration activities.",,,,,Illinois,10 ILCS 5/1A-65,Access requirement,High schools may not prohibit nonpartisan voter-registration activity on campus.
,14,Indiana,Ind. Code § 3-7-31-5,Distribution to students,,Schools provide voter-registration applications to students who will soon be eligible to vote.,“Each high school shall provide a voter registration application to each student who will be at least eighteen (18) years of age before the next general election.”,chat was wrong. the section does not have this langauge. and the language was from a bill that did not pass,,,,Indiana,IC § 3-7-31-5,Forms distributed to students,High schools provide voter-registration applications to students who will be eligible to vote.
7,15,Iowa,Iowa Code § 48A.23,School registration drives,"Opportunity to register:
At least twice during each school year, public and private high schools shall offer the opportunity to register to vote to students who are at least 17 years old.",Schools must offer students voter-registration opportunities.,"Registration at educational institutions. 1. At least twice during each school year, the board of directors of each school district operating a high school and the authorities in charge of each accredited nonpublic school shall offer the opportunity to register to vote to each student who is at least seventeen years of age. 2. All postsecondary schools, including but not limited to colleges, universities, and trade and technical schools which receive state funding, shall offer the opportunity to register to vote to each student at least once each year. Students shall be provided with the federal voter registration form or the Iowa voter registration form, as applicable.",,,,,Iowa,"Iowa Code §§ 48A.23, 280.9A",Mandatory school registration drives,Schools must offer voter-registration opportunities at least twice per school year.
7,15,Iowa,Iowa Code § 280.9A.1. & 4.,Civic instruction + registration,"Education:
Public and private high schools shall require, as a condition of graduation, that high school students receive instruction in voting statutes and procedures, voter registration requirements, the use of paper ballots and voting systems in the election process, and the method of acquiring and casting an absentee ballot.",Civics curriculum includes voter registration instruction and drives.,"1. The board of directors of each local public school district and the authorities in charge of each nonpublic school shall require that all students in grades nine through twelve complete, as a condition of graduation, instruction in American history and the governments of Iowa and the United States, including instruction in voting statutes and procedures, voter registration requirements, the use of paper ballots and voting systems in the election process, and the method of acquiring and casting an absentee ballot.
4. At least twice during each school year, the board of directors of each local public school district operating a high school and the authorities in charge of each accredited nonpublic school operating a high school shall offer the opportunity to register to vote to each student who is at least seventeen years of age, as required by section 48A.23.
88 Acts, ch 1129, §1; 90 Acts, ch 1238, §38; 94 Acts, ch 1169, §57; 2008 ",,,,,,,,
8,16,Kansas,K.S.A. § 25-2303(c),Designation of school personnel,permissive; don't include,Authority to designate school officials as deputy registrars,"(c) Deputy county election officers shall maintain records and perform duties under the provisions of this act only in the manner prescribed by the county election officer. County election officers may appoint such deputy county election officers as deemed appropriate, including, but not limited to, the city clerk of any city, personnel in any public high school, any public library or public institution of higher education, in addition to those required to be appointed under the provisions of subsection (b).",,,,,Kansas,KSA § 25-2307,Forms available,County election officers supply registration forms to high schools.
9,17,Kentucky,Ky. Rev. Stat. § 116.046,Forms + designated staff + annual program,"Form distribution and assistance:
The county clerk shall provide voter registration forms annually to each public and private high school. Each school shall have a designated person who shall be responsible for informing students of the availability of the registration forms and assisting them in registering. ",Clerk required to distribute voter registration forms to high schools. Schools required to designate a staff member responsible for informing students about voter-registration forms. State board of education required to implement annual program,"(1) The county clerk shall provide voter registration forms annually to each principal or assistant principal of every public high school, each area technology center, and private schools, and each school shall have a designated person who shall be responsible for informing students and school personnel of the availability of the registration forms and assist them in properly registering. The completed forms shall be returned to the county clerk, for official registration by the county clerk. (2) Any person designated to assist in registration in subsection (1) of this section shall fulfill this responsibility in an impartial and fair manner and shall not recruit a registrant for any particular party. (3) The State Board of Education shall implement annual programs of public education regarding elections, voting procedures, and election fraud, which shall include an audio-visual presentation for high school juniors and seniors. The State Board of Education, after consultation with the State Board of Elections, shall update the public education programs required by this section as relevant statutory changes occur, as different types of voting systems are used, or as more effective methods of presentation shall be developed.",,,,,Kentucky,KRS § 116.046,Forms + school contact,County clerks supply forms; schools designate staff responsible for informing students.
10,18,Louisiana,La. Rev. Stat. § 17:2121,Registration opportunity,"Opportunity to register:
Public schools shall provide an opportunity for each high school senior who is at least seventeen years old to register to vote by using a school computer to fill out an electronic voter registration application or by using the state mail voter registration application form.
",Schools must allow eligible seniors to register to vote.,"A. Each public school governing authority shall provide an opportunity for each high school senior who is at least seventeen years old to register to vote by using a school computer to fill out an electronic voter registration application or by using the state mail voter registration application form.
B. No public school governing authority shall allow the involvement of any political or partisan group or organization in the registration process.
C. Each public school governing authority shall adopt policies for the implementation of this Section and shall review the policies, at minimum, every five years for the purpose of considering any needed revisions or updates.
D. Each public school governing authority may follow guidance provided by the secretary of state in implementing the provisions of this Section.",,,,,Louisiana,La. Rev. Stat. § 17:2121,Registration opportunity,Schools must give eligible seniors the opportunity to register to vote.
10,18,Louisiana,La. Rev. Stat. § 17:2121.1,Designated day,"Special Days:
The first Tuesday after the first Monday in May annually shall be known as Louisiana High School Seniors Voter Registration Day.",Louisiana High School Senior Voter Registration Day,"A. The first Tuesday after the first Monday in May annually shall be known as Louisiana High School Seniors Voter Registration Day.
B. Nothing in this Section shall be construed to create any duty or obligation for the secretary of state or any registrar of voters.",,,,,,,,
10,18,Louisiana,"La. Admin. Code tit. 31, § II-503.A.2",Designated voter registration agency,"Voter Registration Agencies
Public high schools are designated as voter registration agencies.",Public high schools designated as voter registration agencies,"A. The following offices are hereby designated as voter registration agencies:
... 2. all public high schools",,,,,,,,
11,19,Maine,"Me. Rev. Stat. tit. 21-A, § 181(1)(B)(3)",Voter-registration agencies,"Voter Registration Agencies
Public high schools are designated as voter registration agencies.",Public high schools are designated voter registration agencies under the NVRA,"The designated voter registration agencies pursuant to NVRA include, but are not limited to:  B.(3): The public high schools;  ",,,,,,,,
,20,Maryland,Md. Election Law § 3-203,Forms provided in schools,,Election boards supply voter-registration applications to high schools.,chat was wrong,,,,,Maryland,Election Law § 3-203,Forms provided to schools,Local election boards provide voter-registration applications to high schools.
12,21,Massachusetts,Mass. Gen. Laws ch. 51 § 42C,School registration sessions,,Election officials may hold annual voter-registration sessions in high schools.,"In any city or town which accepts the provisions of this section, voter education and voluntary registration sessions shall be held by the registrars, assistant registrars or election commissioners one day each year between the first day of April and the fifteenth day of May in each public, private and vocational high school in their cities and towns. Said sessions shall take place as part of an educational assembly for all seniors.
A registrar or assistant registrar at a session held pursuant to the provisions of this section may receive affidavits of registration from registrants who reside in any other city or town of the commonwealth. The registrars shall forthwith transmit any such completed affidavits of registration to the registrars of the city or town where the registrant claims to reside, and said registrars shall receive such affidavits as provided in sections forty-six to forty-seven B, inclusive.
This section shall take effect upon its acceptance by any city or town.",,,,,Massachusetts,"M.G.L. ch. 51 §§ 42C, 42E",Registration sessions + forms,High schools host registration assemblies and make registration forms available.
12,21,Massachusetts,Mass. Gen. Laws ch. 51 § 42E,Forms available,,High schools must make voter-registration affidavit forms available to students.,"All public and independent colleges, universities, high schools and vocational schools shall make available affidavit of voter registration forms at all locations where students may register for classes. Such locations shall be published along with the annual course listing for students or in some other schoolwide publication. Every such school shall publicize the availability of such voter registration affidavit forms within the school.",,,,,,,,
